,Name,Purpose
0,"Montoya, Camacho and Harrison",Compatible bottom-line structure for grow vertical e-services
1,Walker Group,Self-enabling asynchronous encryption for embrace revolutionary functionalities
2,Maldonado-Curtis,Switchable background customer loyalty for whiteboard impactful eyeballs
3,"Smith, Richardson and Wright",Devolved homogeneous projection for embrace integrated e-commerce
4,Cruz-Powell,De-engineered 5thgeneration database for morph proactive platforms
5,Massey-Atkinson,Ameliorated systematic database for expedite value-added e-commerce
6,Yu-Mckenzie,Ergonomic asynchronous interface for facilitate leading-edge partnerships
7,Knight Inc,Fundamental global help-desk for integrate web-enabled infrastructures
8,Carroll Group,Horizontal national capability for extend bricks-and-clicks platforms
9,Blackburn-Adams,Profound coherent customer loyalty for unleash 24/365 bandwidth
10,"Kramer, Barber and Carpenter",Sharable intermediate process improvement for synergize seamless metrics
11,Brooks-Reynolds,Innovative full-range structure for incubate extensible markets
12,"Schwartz, Neal and Garcia",Advanced impactful Local Area Network for enhance one-to-one functionalities
13,Hill PLC,Self-enabling global firmware for synergize web-enabled eyeballs
14,"Mcclain, Mccarthy and Lozano",Upgradable clear-thinking data-warehouse for drive killer convergence
15,Powell Ltd,Enterprise-wide intangible contingency for extend frictionless infrastructures
16,"Huffman, Norton and Cantu",Cloned client-driven system engine for envisioneer killer mindshare
17,Schmidt-Brown,Open-architected grid-enabled projection for deploy next-generation content
18,Hanna Group,Team-oriented grid-enabled workforce for enhance magnetic applications
19,Walter PLC,Fundamental explicit extranet for enable integrated action-items
20,Smith-Farmer,Up-sized object-oriented utilization for exploit frictionless initiatives
21,"Le, Chan and Coleman",Ergonomic asynchronous alliance for cultivate sexy portals
22,Levy-Garrison,Proactive multi-tasking approach for mesh next-generation vortals
23,Conway-Massey,Profound homogeneous parallelism for redefine extensible users
24,Bates-Johnson,Distributed didactic portal for mesh integrated synergies
25,"Vance, Michael and Stafford",Triple-buffered transitional encoding for grow impactful initiatives
26,Ball LLC,Exclusive intangible Graphic Interface for target back-end methodologies
27,Landry-Schmidt,Inverse content-based process improvement for envisioneer plug-and-play models
28,Farley Group,Ergonomic dedicated function for scale customized action-items
29,Hicks-Lewis,Persistent zero tolerance synergy for productize distributed models
30,King-Washington,Reverse-engineered mobile middleware for expedite cross-media vortals
31,Castillo PLC,Vision-oriented well-modulated capacity for leverage world-class web services
32,Le-Brock,Team-oriented clear-thinking productivity for grow value-added e-services
33,Smith-Curtis,Cloned contextually-based extranet for reinvent innovative web services
34,Orr-Pierce,Polarized dedicated encoding for strategize plug-and-play methodologies
35,Decker-Grant,Customizable high-level encryption for engineer open-source partnerships
36,Coleman-Lopez,Managed composite structure for implement out-of-the-box models
37,"Harrison, Garcia and Patterson",Cross-platform global methodology for visualize ubiquitous convergence
38,Schwartz PLC,Polarized high-level software for morph strategic deliverables
39,Barajas LLC,Exclusive human-resource success for envisioneer robust technologies
40,Pope and Sons,Horizontal asymmetric Local Area Network for seize sticky bandwidth
41,"Anderson, Smith and Cox",Multi-tiered even-keeled matrix for synthesize back-end platforms
42,Morgan Inc,Self-enabling tangible migration for repurpose bleeding-edge portals
43,Larson-Steele,Enhanced directional pricing structure for empower sticky interfaces
44,"Miller, Jensen and Nash",User-centric bifurcated analyzer for synthesize interactive infrastructures
45,Rodriguez PLC,Integrated object-oriented moratorium for aggregate vertical paradigms
46,Cardenas Group,Phased stable monitoring for facilitate robust architectures
47,Rivera-Flores,Proactive client-server interface for expedite out-of-the-box ROI
48,Myers and Sons,Organized upward-trending methodology for facilitate dynamic metrics
49,Patrick Ltd,Extended didactic workforce for matrix cross-media solutions
